{
  "$schema": "./profile.schema.json",
  "name": "exploit",
  "description": "Exploitation tools (sqlmap, metasploit, msfvenom, hydra, medusa, ncrack, command injection probes). Most aggressive isolation profile: separate user namespace, dropped caps, RO root. Network egress stays attached because exploit primitives need to reach the target; scope_validator is the gatekeeper for which IP/host is allowed.",
  "bind_ro": ["/usr", "/etc", "/lib", "/lib64", "/bin", "/sbin", "/opt/metasploit-framework"],
  "workdir_template": "/tmp/sap-{run_id}/exploit",
  "workdir_mount": "/work",
  "tmpfs": ["/tmp", "/var/tmp"],
  "dev": true,
  "proc": true,
  "as_pid_1": true,
  "unshare_user": true,
  "unshare_pid": true,
  "unshare_ipc": true,
  "unshare_uts": true,
  "network_policy": "in_scope",
  "caps_drop": ["ALL"],
  "caps_keep": []
}
